{
  "acquisitionUrl": "https://example.invalid/source.dat",
  "allowedRoles": [
    "contract-test"
  ],
  "attribution": "Synthetic fixture.",
  "bytes": 12,
  "canonicalUrl": "https://example.invalid/source",
  "finalUrl": "https://example.invalid/source.dat",
  "license": {
    "name": "CC0-1.0",
    "noticeFile": "notices/fixture-source.license",
    "noticeSha256": "bbbbbbbbbbbbbbbbbbbbbbbbbbbbbbbbbbbbbbbbbbbbbbbbbbbbbbbbbbbbbbbb",
    "url": "https://creativecommons.org/publicdomain/zero/1.0/legalcode"
  },
  "mediaType": "application/octet-stream",
  "rawFile": null,
  "rawRetention": "temporary-deleted",
  "redistribution": "raw-and-derived",
  "retrievedAt": "2026-09-30T00:00:00Z",
  "schemaVersion": 1,
  "sha256": "aaaaaaaaaaaaaaaaaaaaaaaaaaaaaaaaaaaaaaaaaaaaaaaaaaaaaaaaaaaaaaaa",
  "sourceId": "source2:fixture-source",
  "verification": {
    "archiveSafe": true,
    "expectedIdentityMatch": true,
    "hashVerified": true,
    "httpStatus": 200,
    "registryMatch": true,
    "unexpectedFormat": false
  }
}
